{
  "schema_version": 1,
  "build": {
    "tool": "gradle",
    "java_version": "25",
    "arguments": [
      "build"
    ]
  },
  "tag_prefix": "v",
  "assets": [
    {
      "path": "build/libs/Yaminabe-Paper-{version}.jar",
      "name": "Yaminabe-Paper-{version}.jar"
    },
    {
      "path": "build/libs/Yaminabe-Velocity-{version}.jar",
      "name": "Yaminabe-Velocity-{version}.jar"
    }
  ]
}
